{
  "base_commit": "e46844919cc7adc9bf4aafb5aeecb6ba6f8d0c8a",
  "checks": {
    "ascii_policy_status": {
      "detail": "Reviewer-facing tracked text is ASCII-only",
      "status": "PASS"
    },
    "changelog_status": {
      "detail": "All 1 required files present",
      "status": "PASS"
    },
    "claim_boundary_status": {
      "detail": "Claim boundaries valid for reference product spec",
      "status": "PASS"
    },
    "engine_product_separation_status": {
      "detail": "Engine/product separation enforced in src/",
      "status": "PASS"
    },
    "evidence_contract_status": {
      "detail": "Evidence contract modules and validation CLI present",
      "status": "PASS"
    },
    "external_evidence_ingestion_status": {
      "detail": "External evidence ingestion workflow present",
      "status": "PASS"
    },
    "generated_output_policy_status": {
      "detail": "No untracked-policy generated outputs committed",
      "status": "PASS"
    },
    "no_tag_exists_status": {
      "detail": "No local release tag exists",
      "status": "PASS"
    },
    "no_tag_no_publish_statement_status": {
      "detail": "All 1 required files present",
      "status": "PASS"
    },
    "package_metadata": {
      "detail": "Package metadata present in pyproject.toml and README.md",
      "status": "PASS"
    },
    "raw_file_policy_status": {
      "detail": "No raw coordinate files tracked",
      "status": "PASS"
    },
    "reference_product_spec_status": {
      "detail": "Reference product spec remains TDF_DESIGN_CANDIDATE with safety flags false",
      "status": "PASS"
    },
    "release_candidate_checklist_status": {
      "detail": "All 1 required files present",
      "status": "PASS"
    },
    "release_chain_status": {
      "detail": "Release chain status documents current package state",
      "status": "PASS"
    },
    "release_notes_draft_status": {
      "detail": "All 1 required files present",
      "status": "PASS"
    },
    "required_clis_present": {
      "detail": "All 6 required files present",
      "status": "PASS"
    },
    "required_cto_bundle_requirements_present": {
      "detail": "CTO review bundle requirements documented and referenced",
      "status": "PASS"
    },
    "required_project_control_docs_present": {
      "detail": "All 12 required files present",
      "status": "PASS"
    },
    "required_schemas_present": {
      "detail": "All 11 required files present",
      "status": "PASS"
    },
    "reviewer_package_builder_status": {
      "detail": "Reviewer package builder CLI and module present",
      "status": "PASS"
    },
    "secret_file_policy_status": {
      "detail": "No secrets, tokens, or cache paths tracked",
      "status": "PASS"
    },
    "static_policy_status": {
      "detail": "PASS",
      "status": "PASS"
    },
    "tests_passed_status": {
      "detail": "112 passed, 1 skipped in 9.70s",
      "status": "PASS"
    },
    "version_consistency": {
      "detail": "Versions aligned with target 0.1.0: __version__=0.1.0, pyproject=0.1.0",
      "status": "PASS"
    }
  },
  "generated_at_commit": "6d1f8b31607e3d4fbfb1a77f62faed2722e5c00f",
  "github_release_created": false,
  "governance_notes": [
    "CTO review required before tag, GitHub release, or package publish",
    "Real product package generation blocked pending CTO approval",
    "Runtime integration with tdf-openmm-validation blocked"
  ],
  "known_blockers": [],
  "lammps_executed": false,
  "openmm_executed": false,
  "package_published": false,
  "package_version": "0.1.0",
  "pyproject_version": "0.1.0",
  "readiness_stage_upgraded": false,
  "release_action_taken": false,
  "release_readiness_decision": "READY_FOR_RELEASE_DRAFT",
  "report_version": "1.0",
  "repository": "https://github.com/bahman2017/tdf-product-artifact-builder",
  "runtime_tdf_openmm_validation_import": false,
  "simulation_executed": false,
  "tag_created": false,
  "target_version": "0.1.0",
  "tracked_product_package_generated": false
}
